{
  "currency": "EUR",
  "observed": "2026-10-22",
  "source": "aggregated used-market observations",
  "devices": [
    {
      "device": "xiaomi-surya",
      "estimate_eur": [
        80,
        130
      ],
      "samples": null,
      "note": "complete used devices"
    },
    {
      "device": "fairphone-fp4",
      "estimate_eur": [
        280,
        330
      ],
      "samples": null,
      "note": "private sellers; 8/256 commercial around 396"
    },
    {
      "device": "fairphone-fp5",
      "estimate_eur": null,
      "samples": null,
      "note": "most listings above 300; not counted live"
    },
    {
      "device": "oneplus-enchilada",
      "estimate_eur": [
        110,
        121
      ],
      "samples": 2,
      "note": "unmodified devices of 11 used listings"
    },
    {
      "device": "oneplus-fajita",
      "estimate_eur": [
        133,
        166
      ],
      "samples": 4,
      "note": "unmodified devices; new units 134-143"
    },
    {
      "device": "google-sargo",
      "estimate_eur": [
        94,
        185
      ],
      "samples": 6,
      "note": "buy-it-now of unmodified devices"
    },
    {
      "device": "google-bonito",
      "estimate_eur": [
        99,
        153
      ],
      "samples": 3,
      "note": "unmodified devices"
    },
    {
      "device": "google-oriole",
      "estimate_eur": [
        122,
        179
      ],
      "samples": null,
      "note": "used complete handsets, title-filtered, 2026-10-18"
    },
    {
      "device": "google-raven",
      "estimate_eur": [
        111,
        200
      ],
      "samples": null,
      "note": "used complete handsets, title-filtered, 2026-10-18"
    },
    {
      "device": "oneplus-guacamole",
      "estimate_eur": [
        140,
        199
      ],
      "samples": null,
      "note": "used complete handsets, title-filtered, 2026-10-18"
    },
    {
      "device": "oneplus-instantnoodlep",
      "estimate_eur": [
        99,
        228
      ],
      "samples": null,
      "note": "used complete handsets, title-filtered, 2026-10-18"
    },
    {
      "device": "oneplus-kebab",
      "estimate_eur": [
        110,
        259
      ],
      "samples": null,
      "note": "used complete handsets, title-filtered, 2026-10-18"
    },
    {
      "device": "nothing-spacewar",
      "estimate_eur": [
        150,
        180
      ],
      "samples": null,
      "note": "used complete handsets, title-filtered, 2026-10-18"
    },
    {
      "device": "nothing-tetris",
      "estimate_eur": [
        119,
        290
      ],
      "samples": null,
      "note": "used complete handsets, title-filtered, 2026-10-18"
    },
    {
      "device": "xiaomi-vayu",
      "estimate_eur": [
        99,
        178
      ],
      "samples": null,
      "note": "vayu = global model; bhima = India variant with separate firmware"
    },
    {
      "device": "motorola-dubai",
      "estimate_eur": [
        113,
        149
      ],
      "samples": null,
      "note": "used complete handsets, title-filtered, 2026-10-18"
    },
    {
      "device": "sony-pdx215",
      "estimate_eur": [
        199,
        285
      ],
      "samples": null,
      "note": "used complete handsets, title-filtered, 2026-10-18"
    },
    {
      "device": "samsung-a72q",
      "estimate_eur": [
        120,
        220
      ],
      "samples": null,
      "note": "4G model SM-A725x only; Galaxy A72 5G (SM-A726B) is a different device"
    },
    {
      "device": "fairphone-fp6",
      "estimate_eur": [
        500,
        500
      ],
      "samples": 1,
      "note": "single listing observed; thin used supply"
    },
    {
      "device": "xiaomi-cepheus",
      "estimate_eur": [
        65,
        120
      ],
      "samples": null,
      "note": "8GB variants rare on ebay.de; observed listings 65-90 EUR are mostly 6GB"
    },
    {
      "device": "xiaomi-equuleus",
      "estimate_eur": null,
      "samples": null,
      "note": "no complete-device listings on ebay.de right now"
    },
    {
      "device": "xiaomi-begonia",
      "estimate_eur": [
        60,
        150
      ],
      "samples": null,
      "note": "used complete handsets, title-filtered, 2026-10-18"
    },
    {
      "device": "xiaomi-miatoll",
      "estimate_eur": [
        46,
        120
      ],
      "samples": null,
      "note": "8/128 only on global Note 9 Pro; codename also covers 9S/curtana/joyeuse/gram"
    },
    {
      "device": "xiaomi-pipa",
      "estimate_eur": [
        195,
        220
      ],
      "samples": null,
      "note": "tablet; used 8/256 ~220 EUR, 6/128 ~195 EUR"
    },
    {
      "device": "shift-otter",
      "estimate_eur": [
        630,
        630
      ],
      "samples": 1,
      "note": "no used market yet; one new 8.1 512GB listing"
    },
    {
      "device": "jolla-c2",
      "estimate_eur": [
        449,
        449
      ],
      "samples": 1,
      "note": "single listing observed; niche community device"
    },
    {
      "device": "google-bluejay",
      "estimate_eur": [
        97,
        135
      ],
      "samples": null,
      "note": "used complete handsets, title-filtered, 2026-10-18"
    },
    {
      "device": "google-flame",
      "estimate_eur": [
        109,
        109
      ],
      "samples": 1,
      "note": "thin used supply"
    },
    {
      "device": "xiaomi-pyxis",
      "estimate_eur": [
        70,
        94
      ],
      "samples": null,
      "note": "used complete handsets, title-filtered, 2026-10-18"
    },
    {
      "device": "xiaomi-gauguin",
      "estimate_eur": [
        59,
        130
      ],
      "samples": null,
      "note": "always 6GB; listings advertising 8GB are mislabeled"
    },
    {
      "device": "xiaomi-jasmine_sprout",
      "estimate_eur": null,
      "samples": null,
      "note": "no qualifying used listings in current search window"
    },
    {
      "device": "xiaomi-polaris",
      "estimate_eur": null,
      "samples": null,
      "note": "only a 6/64 listing seen (120 EUR); 8GB variant not observed"
    },
    {
      "device": "razer-aura",
      "estimate_eur": [
        128,
        186
      ],
      "samples": null,
      "note": "single config 8/64; gaming phone"
    },
    {
      "device": "asus-zs620kl",
      "estimate_eur": null,
      "samples": null,
      "note": "one 64GB listing seen, RAM not stated"
    },
    {
      "device": "samsung-beyond1lte",
      "estimate_eur": [
        65,
        150
      ],
      "samples": null,
      "note": "SM-G973F only; 8/128 and 8/512 observed"
    },
    {
      "device": "samsung-beyond2lte",
      "estimate_eur": [
        127,
        195
      ],
      "samples": null,
      "note": "12GB only with 1TB ceramic"
    },
    {
      "device": "samsung-beyondx",
      "estimate_eur": null,
      "samples": null,
      "note": "not searched live"
    },
    {
      "device": "samsung-d1",
      "estimate_eur": [
        95,
        250
      ],
      "samples": null,
      "note": "single config 8/256"
    },
    {
      "device": "samsung-d1x",
      "estimate_eur": [
        128,
        270
      ],
      "samples": null,
      "note": "always 12GB"
    },
    {
      "device": "samsung-a52q",
      "estimate_eur": null,
      "samples": null,
      "note": "not searched live"
    },
    {
      "device": "xiaomi-alioth",
      "estimate_eur": [
        119,
        150
      ],
      "samples": 1,
      "note": "used complete handsets, title-filtered, 2026-10-19; port candidate: sm8250 family kernel already used by elish/pipa in mainline; alioth DT missing; backmarket.de sold out (live check), 2026-10-19"
    },
    {
      "device": "xiaomi-lmi",
      "estimate_eur": [
        110,
        110
      ],
      "samples": 1,
      "note": "used complete handsets, title-filtered, 2026-10-19; port candidate: sm8250 family; no mainline DT yet"
    },
    {
      "device": "xiaomi-raphael",
      "estimate_eur": [
        50,
        150
      ],
      "samples": 1,
      "note": "used complete handsets, title-filtered, 2026-10-19; port candidate: sm8150 family like vayu; many unlocked-bootloader units"
    },
    {
      "device": "xiaomi-umi",
      "estimate_eur": [
        177,
        177
      ],
      "samples": null,
      "note": null
    },
    {
      "device": "oppo-cph2025",
      "estimate_eur": [
        180,
        255
      ],
      "samples": 1,
      "note": "used complete handsets, title-filtered, 2026-10-19; port candidate: no mainline DT; Oppo bootloader unlock restricted"
    },
    {
      "device": "oppo-cph2009",
      "estimate_eur": [
        99,
        152
      ],
      "samples": 1,
      "note": "used complete handsets, title-filtered, 2026-10-19; port candidate: no mainline DT; 12GB in every variant"
    },
    {
      "device": "realme-rmx3301",
      "estimate_eur": [
        172,
        172
      ],
      "samples": 1,
      "note": "used complete handsets, title-filtered, 2026-10-19; port candidate: sm8450 family; 1 used listing 12/256 at 172 EUR; 8/128 was EU base variant"
    },
    {
      "device": "xiaomi-ares",
      "estimate_eur": [
        160,
        160
      ],
      "samples": 1,
      "note": "used complete handsets, title-filtered, 2026-10-19; MediaTek; mainline support very weak; only for completeness"
    },
    {
      "device": "xiaomi-xaga",
      "estimate_eur": [
        160,
        190
      ],
      "samples": 2,
      "note": "used complete handsets (X4 GT 8/128 160, 8/256 190), 2026-10-19; backmarket.de sold out (live check), 2026-10-19"
    },
    {
      "device": "xiaomi-haydn",
      "estimate_eur": [
        185,
        195
      ],
      "samples": 2,
      "note": "used complete handsets, 2026-10-19; K40 Pro unlocked+TWRP 185; Mi 11i EU 8/256 ~195; port candidate SD888"
    },
    {
      "device": "xiaomi-apollo",
      "estimate_eur": [
        55,
        100
      ],
      "samples": 2,